{"schema_version":1,"mode":"advisory","advisory":true,"status":"inconclusive","binding":{"repository":"FlitCatz/policy-kernel","pull_request_number":2,"head_sha":"cccccccccccccccccccccccccccccccccccccccc","policy_digest":"aaaaaaaaaaaaaaaaaaaaaaaaaaaaaaaaaaaaaaaaaaaaaaaaaaaaaaaaaaaaaaaa","evidence_digest":"dddddddddddddddddddddddddddddddddddddddddddddddddddddddddddddddd","evaluated_at":"2026-09-04T09:00:00Z"},"reasons":[{"code":"PK-PRE-ADVISORY","message":"Local evaluation is advisory"}],"decision_digest":"eeeeeeeeeeeeeeeeeeeeeeeeeeeeeeeeeeeeeeeeeeeeeeeeeeeeeeeeeeeeeeee"}
